{
  "$schema": "https://json-schema.org/draft/2020-12/schema",
  "$id": "urn:research-os:contracts:v1:worker-result",
  "title": "WorkerResult",
  "description": "Untrusted Worker execution output. NOT Observation, Artifact, Evidence, Candidate, Finding, or Hypothesis outcome. EXECUTION_FAILED is not Hypothesis REJECTED. raw_result and descriptors are not Transition A records.",
  "type": "object",
  "additionalProperties": false,
  "required": [
    "contract_version",
    "correlation",
    "worker_id",
    "status"
  ],
  "properties": {
    "contract_version": {
      "const": "v1"
    },
    "correlation": {
      "$ref": "urn:research-os:contracts:v1:correlation-context"
    },
    "worker_id": {
      "type": "string",
      "minLength": 1,
      "description": "Opaque Worker runtime identity (Decision 015). Not Core. Not authorization."
    },
    "status": {
      "type": "string",
      "enum": [
        "SUCCEEDED",
        "EXECUTION_FAILED",
        "BLOCKED",
        "CANCELLED",
        "TIMED_OUT",
        "BUDGET_EXHAUSTED",
        "REAUTHORIZATION_REQUIRED"
      ],
      "description": "Execution status. Not Hypothesis outcome. Not Evidence."
    },
    "started_at": {
      "type": "string",
      "minLength": 1,
      "format": "date-time",
      "description": "RFC 3339 / ISO 8601 timezone-aware timestamp string. Transport-neutral. Not a database timestamptz type. format enforcement depends on a later validator decision."
    },
    "completed_at": {
      "type": "string",
      "minLength": 1,
      "format": "date-time",
      "description": "RFC 3339 / ISO 8601 timezone-aware timestamp string. Transport-neutral. Not a database timestamptz type. format enforcement depends on a later validator decision."
    },
    "raw_result": {
      "type": "object",
      "additionalProperties": true,
      "description": "Untrusted execution payload. MUST NOT carry authorization, budget authority, Evidence, Finding, or Approval."
    },
    "raw_artifact_descriptors": {
      "type": "array",
      "items": {
        "type": "object",
        "additionalProperties": true,
        "description": "Untrusted descriptor of produced bytes. NOT an Artifact SoR record."
      },
      "description": "Not Artifact identity/metadata in PostgreSQL. Transition A creates Artifacts later."
    },
    "diagnostics": {
      "type": "object",
      "additionalProperties": true,
      "description": "Untrusted diagnostics. Not AuditEvent. Not truth. MUST NOT contain secret values."
    },
    "control_signal": {
      "type": "object",
      "additionalProperties": true,
      "description": "Optional untrusted control/debug bag. Not an authorization decision. Reauthorization uses ReauthorizationRequest."
    }
  }
}
